{
  "$schema": "https://json-schema.org/draft/2020-12/schema",
  "$id": "https://github.com/Arasz/ai-badger/schemas/plugin-entry.schema.json",
  "title": "ai-badger plugin entry",
  "description": "A curated external plugin+marketplace selection (plugins.json inside a <stack>/plugins/<name>/ dir). Marketplaces are referenced via a sibling marketplaces.json.",
  "type": "object",
  "required": ["name", "plugins"],
  "additionalProperties": false,
  "properties": {
    "name": { "type": "string", "minLength": 1 },
    "description": { "type": "string" },
    "scope": {
      "enum": ["default", "local", "user"],
      "default": "default",
      "description": "default = inherit the scope chosen at init; local = project scope; user = user scope."
    },
    "marketplacesRef": {
      "type": "string",
      "default": "marketplaces.json",
      "description": "Path (relative to this entry dir) to the marketplaces.json declaring where the plugins come from."
    },
    "plugins": {
      "type": "array",
      "minItems": 1,
      "items": { "type": "string" },
      "description": "Plugin names to install from the referenced marketplace(s)."
    }
  }
}
